{"schema_version":"0.1","calculation_id":"TCO-GGM-HAS2S","requirement_id":"PR-2026-MUNICH-COFFEE-001","candidate_id":"GGM-HAS2S-DE-MUNICH-2026","calculation_status":"PARTIAL","comparison_currency":"CNY","exchange_rates":[{"from_currency":"EUR","to_currency":"CNY","rate":7.8414,"rate_type":"APPROXIMATE_REFERENCE","observed_at":"2026-08-25T10:20:00Z","source_note":"采购比较场景参考汇率","confidence":"MEDIUM"}],"cost_components":[{"code":"ITEM_PRICE","label":"设备页面价格","original_amount":{"amount":297.49,"currency":"EUR"},"converted_cny":2332.74,"included_in_tco":true,"basis":"LISTED","confidence":"HIGH","evidence_refs":["examples/product-candidate.equipment.coffee-machine.example.json#EV-GGM-HAS2S-PAGE"]}],"known_cost_total_cny":2332.74,"estimated_tco_cny":2332.74,"unknown_costs":[{"code":"FINAL_TAX","description":"最终含税口径待下单时刷新","materiality":"MEDIUM","blocking":false,"treatment":"EXCLUDED_AND_FLAGGED"},{"code":"FINAL_DELIVERY","description":"送达慕尼黑具体地址的最终费用","materiality":"MEDIUM","blocking":false,"treatment":"QUOTE_REQUIRED"}],"price_display":{"display_text":"¥2,333（原价 €297.49）","cny_amount":2332.74,"original_amount":{"amount":297.49,"currency":"EUR"},"is_estimate":true,"rounding_rule":"NEAREST_YUAN"},"scoring":{"profile":"BALANCED","dimensions":[{"code":"PRODUCT_MATCH","score":85,"weight":0.3,"weighted_score":25.5,"reason":"商用结构匹配但饮品程序有限","confidence":"MEDIUM","evidence_refs":["examples/candidate-match.equipment.coffee-machine.example.json"]},{"code":"PRICE","score":88,"weight":0.25,"weighted_score":22,"reason":"比较价明显低于预算","confidence":"MEDIUM","evidence_refs":[]},{"code":"SUPPLIER","score":80,"weight":0.2,"weighted_score":16,"reason":"德国专业供应商，数字评分缺失","confidence":"MEDIUM","evidence_refs":[]},{"code":"DELIVERY","score":85,"weight":0.15,"weighted_score":12.75,"reason":"德国境内履约但未来库存待确认","confidence":"MEDIUM","evidence_refs":[]},{"code":"QUALITY_RISK","score":80,"weight":0.1,"weighted_score":8,"reason":"关键规格可核验，售后待确认","confidence":"MEDIUM","evidence_refs":[]}],"overall_score":84.25,"score_status":"PROVISIONAL","score_explanation":"五维加权总分；最终库存、税费和送达费用确认后刷新"},"ranking":{"eligible":true,"blocking_reasons":[],"rank":null,"recommendation_role":"PRIMARY"},"provenance":{"created_at":"2026-08-26T12:00:00Z","updated_at":"2026-08-26T12:00:00Z","created_by":"Procurement-price-comparison Agent","model_version":"0.1-candidate","overall_confidence":"MEDIUM","assumptions":["汇率采用大致参考值","未知成本未按零处理"]}}

