{"schema_version":"0.1","calculation_id":"TCO-1688-MASCOT","requirement_id":"PR-IP-MASCOT-001","candidate_id":"1688-817907206474-MASCOT","calculation_status":"UNAVAILABLE","comparison_currency":"CNY","exchange_rates":[],"cost_components":[{"code":"ITEM_PRICE","label":"页面起始展示价（不纳入TCO）","original_amount":{"amount":500,"currency":"CNY"},"converted_cny":500,"included_in_tco":false,"basis":"LISTED","confidence":"LOW","evidence_refs":["cases/ip-mascot-costume/product-candidate-1688-817907206474-real-regression.json"]}],"known_cost_total_cny":null,"estimated_tco_cny":null,"unknown_costs":[{"code":"CUSTOM_QUOTE","description":"锁定IP设计后的完整制作报价","materiality":"HIGH","blocking":true,"treatment":"QUOTE_REQUIRED"},{"code":"DOMESTIC_FREIGHT","description":"国内送货费用","materiality":"MEDIUM","blocking":true,"treatment":"QUOTE_REQUIRED"}],"price_display":{"display_text":"暂无可比总价（页面起始价 ¥500）","cny_amount":null,"original_amount":{"amount":500,"currency":"CNY"},"is_estimate":true,"rounding_rule":"NEAREST_YUAN"},"scoring":{"profile":"BALANCED","dimensions":[{"code":"PRODUCT_MATCH","score":null,"weight":0.3,"weighted_score":null,"reason":"材料工艺未确认","confidence":"UNVERIFIED","evidence_refs":[]},{"code":"PRICE","score":null,"weight":0.25,"weighted_score":null,"reason":"无完整报价","confidence":"UNVERIFIED","evidence_refs":[]},{"code":"SUPPLIER","score":null,"weight":0.2,"weighted_score":null,"reason":"主体资料不足","confidence":"UNVERIFIED","evidence_refs":[]},{"code":"DELIVERY","score":null,"weight":0.15,"weighted_score":null,"reason":"10天交期未确认","confidence":"UNVERIFIED","evidence_refs":[]},{"code":"QUALITY_RISK","score":null,"weight":0.1,"weighted_score":null,"reason":"高还原能力需案例和样品证明","confidence":"UNVERIFIED","evidence_refs":[]}],"overall_score":null,"score_status":"NOT_SCORED","score_explanation":"入口价不能作为完整定制TCO"},"ranking":{"eligible":false,"blocking_reasons":["无完整定制报价","材料与交期未确认"],"rank":null,"recommendation_role":"NONE"},"provenance":{"created_at":"2026-08-26T12:00:00Z","updated_at":"2026-08-26T12:00:00Z","created_by":"Procurement-price-comparison Agent","model_version":"0.1-candidate","overall_confidence":"LOW","assumptions":["500元仅为页面起始价"]}}

