{"schema_version":"0.1","calculation_id":"TCO-TB-DESIGN","requirement_id":"PR-RESIDENTIAL-DESIGN-001","candidate_id":"TAOBAO-1005370435991-DESIGN-SERVICE","calculation_status":"UNAVAILABLE","comparison_currency":"CNY","exchange_rates":[],"cost_components":[{"code":"SERVICE_FEE","label":"页面入口价（不纳入TCO）","original_amount":{"amount":50,"currency":"CNY"},"converted_cny":50,"included_in_tco":false,"basis":"LISTED","confidence":"LOW","evidence_refs":["cases/residential-floor-plan-design/product-candidate-taobao-1005370435991-real-regression.json"]}],"known_cost_total_cny":null,"estimated_tco_cny":null,"unknown_costs":[{"code":"ALL_IN_FEE","description":"150平方米全包设计费","materiality":"HIGH","blocking":true,"treatment":"QUOTE_REQUIRED"},{"code":"REVISION_FEE","description":"超出包含轮次后的修改费","materiality":"MEDIUM","blocking":false,"treatment":"QUOTE_REQUIRED"}],"price_display":{"display_text":"暂无可比总价（页面入口价 ¥50）","cny_amount":null,"original_amount":{"amount":50,"currency":"CNY"},"is_estimate":true,"rounding_rule":"NEAREST_YUAN"},"scoring":{"profile":"BALANCED","dimensions":[{"code":"PRODUCT_MATCH","score":null,"weight":0.3,"weighted_score":null,"reason":"交付范围待确认","confidence":"UNVERIFIED","evidence_refs":[]},{"code":"PRICE","score":null,"weight":0.25,"weighted_score":null,"reason":"无全包报价","confidence":"UNVERIFIED","evidence_refs":[]},{"code":"SUPPLIER","score":null,"weight":0.2,"weighted_score":null,"reason":"作品与主体待核验","confidence":"UNVERIFIED","evidence_refs":[]},{"code":"DELIVERY","score":null,"weight":0.15,"weighted_score":null,"reason":"两周交期待确认","confidence":"UNVERIFIED","evidence_refs":[]},{"code":"QUALITY_RISK","score":null,"weight":0.1,"weighted_score":null,"reason":"修改轮次和源文件未知","confidence":"UNVERIFIED","evidence_refs":[]}],"overall_score":null,"score_status":"NOT_SCORED","score_explanation":"入口价不是150平方米全包服务费"},"ranking":{"eligible":false,"blocking_reasons":["无全包报价"],"rank":null,"recommendation_role":"NONE"},"provenance":{"created_at":"2026-08-26T12:00:00Z","updated_at":"2026-08-26T12:00:00Z","created_by":"Procurement-price-comparison Agent","model_version":"0.1-candidate","overall_confidence":"LOW","assumptions":["50元仅为页面入口价"]}}

