{"schema_version":"0.1","calculation_id":"TCO-TB-RECCI-SPEAKER","requirement_id":"PR-BT-SPEAKER-GIFT-001","candidate_id":"TAOBAO-726948050702-BLUE-QTY10","calculation_status":"PARTIAL","comparison_currency":"CNY","exchange_rates":[],"cost_components":[{"code":"ITEM_PRICE","label":"10个蓝色SKU商品小计","original_amount":{"amount":780,"currency":"CNY"},"converted_cny":780,"included_in_tco":true,"basis":"CALCULATED","confidence":"HIGH","evidence_refs":["cases/bluetooth-speaker-giveaway/product-candidate-taobao-726948050702-real-regression.json"]}],"known_cost_total_cny":780,"estimated_tco_cny":780,"unknown_costs":[{"code":"LOGO_FEE","description":"10个Logo定制费用","materiality":"MEDIUM","blocking":true,"treatment":"QUOTE_REQUIRED"},{"code":"DOMESTIC_FREIGHT","description":"国内运费","materiality":"LOW","blocking":false,"treatment":"QUOTE_REQUIRED"}],"price_display":{"display_text":"¥780","cny_amount":780,"original_amount":{"amount":780,"currency":"CNY"},"is_estimate":true,"rounding_rule":"NEAREST_YUAN"},"scoring":{"profile":"BALANCED","dimensions":[{"code":"PRODUCT_MATCH","score":null,"weight":0.3,"weighted_score":null,"reason":"Logo MOQ尚未确认","confidence":"UNVERIFIED","evidence_refs":[]},{"code":"PRICE","score":null,"weight":0.25,"weighted_score":null,"reason":"Logo费和运费未知","confidence":"UNVERIFIED","evidence_refs":[]},{"code":"SUPPLIER","score":null,"weight":0.2,"weighted_score":null,"reason":"供应商资料不足","confidence":"UNVERIFIED","evidence_refs":[]},{"code":"DELIVERY","score":null,"weight":0.15,"weighted_score":null,"reason":"交期未知","confidence":"UNVERIFIED","evidence_refs":[]},{"code":"QUALITY_RISK","score":null,"weight":0.1,"weighted_score":null,"reason":"未取得样品信息","confidence":"UNVERIFIED","evidence_refs":[]}],"overall_score":null,"score_status":"NOT_SCORED","score_explanation":"关键费用与履约信息不足，不提前评分"},"ranking":{"eligible":false,"blocking_reasons":["Logo费用和MOQ未确认"],"rank":null,"recommendation_role":"NONE"},"provenance":{"created_at":"2026-08-26T12:00:00Z","updated_at":"2026-08-26T12:00:00Z","created_by":"Procurement-price-comparison Agent","model_version":"0.1-candidate","overall_confidence":"LOW","assumptions":["人民币原价不重复显示括号"]}}

